,PID: Dem (no lean),PID: Ind (no lean),PID: Rep (no lean),overall
Neither are responsible,0.051865000355732285,0.17123063175713746,0.170364941180939,0.12187466927674556
Don't know/ No opinion,0.08889492766575516,0.11611303534183794,0.061701042845273904,0.08415223452595431
Mainly the responsibility of government,0.1856786919706205,0.09314180316290256,0.1597647722767998,0.15659385665122535
Mainly the responsibility of social media platforms,0.29796502789164947,0.3004207999517285,0.2809203701171958,0.29196425948880783
Social media platforms and government should share the responsibility,0.3755963521162426,0.3190937297863935,0.3272488735797915,0.34541498005726695
