,PID: Dem (no lean),PID: Dem (no lean),PID: Dem (no lean),PID: Dem (no lean),PID: Dem (no lean),PID: Ind (no lean),PID: Ind (no lean),PID: Ind (no lean),PID: Ind (no lean),PID: Ind (no lean),PID: Rep (no lean),PID: Rep (no lean),PID: Rep (no lean),PID: Rep (no lean),PID: Rep (no lean)
,Information about how to register and vote,Information about how elections are run,Information about who won an election,Information about candidates,News about campaigns,Information about how to register and vote,Information about how elections are run,Information about who won an election,Information about candidates,News about campaigns,Information about how to register and vote,Information about how elections are run,Information about who won an election,Information about candidates,News about campaigns
A few times in the weeks around major election dates or deadlines,0.13748837424072777,0.19485685745807155,0.15584552764159304,0.1783065459998097,0.17278543990999523,0.14490188308948265,0.16745941860549063,0.16556894860392404,0.19466611370645995,0.19198719265008385,0.14246396434790085,0.1866668633143176,0.15653634970580463,0.18259524791494003,0.19265765217000988
Consistently throughout the year,0.15035343756797515,0.15869020183734106,0.1893508010863288,0.2761411974342872,0.2272272754141712,0.13246154028154863,0.1473420617168206,0.1608414385577651,0.2639119388718089,0.23054722274076975,0.14945281989669734,0.17174438418066332,0.19523255050384716,0.28896835504548485,0.24214913824077178
Regularly in the weeks around major election dates or deadlines,0.22031599631168922,0.2223165878572766,0.22443611431683957,0.28837389113510054,0.29352428851377843,0.10683200542456,0.16040060344921622,0.1950035609199431,0.23037453218302442,0.24480115633507096,0.17722470397870374,0.18675855381195394,0.21287518880030562,0.2671132125562446,0.2650796250507905
Never,0.23838777942028136,0.22130789380716123,0.10172515590589783,0.10361041462303974,0.13350641220325338,0.3401573583659886,0.2875764581595608,0.11990478480943055,0.13114517931365652,0.17818403747915335,0.2706132932553099,0.23490825051606357,0.09336423012835451,0.10115647317652075,0.13541626888803346
"Only around major election dates or deadlines (e.g. Voter registration deadlines, Election Day)",0.2534544124593266,0.20282845904014965,0.32864240104934084,0.1535679508077627,0.17295658395880187,0.27564721283842003,0.23722145806891182,0.3586812671089371,0.17990223592505028,0.15448039079492218,0.2602452185213881,0.21992194817700159,0.34199168086168813,0.16016671130680976,0.16469731565039447
