,Age: 18-34,Age: 35-44,Age: 45-64,Age: 65+,overall
"Other, please specify",0.0004143435309884495,3.174925344090839e-09,0.006758067855848095,0.01397445160785026,0.005882956447614871
I do not use any of these approaches,0.11353936159011127,0.08010069235359543,0.13734710838539754,0.1481690091250117,0.1251178620652914
Consult experts or specialists on the topic,0.1520623596742294,0.21191552947825565,0.10287880388803747,0.10877522142126639,0.13375819078563353
Read information from friends with a variety of viewpoints,0.21319736355426752,0.28008748785580395,0.16740123135431698,0.13187239469064946,0.1876575742534944
Ensure that my social media feed reflects a variety of viewpoints,0.21678011315091725,0.22487921005727682,0.07937366833137408,0.060451421264396205,0.13239201579730187
Verify information by using fact-checking websites,0.27957817788951667,0.40506363009389046,0.2689331596270415,0.28134678718375045,0.2956737620518972
Compare information across multiple sources,0.2850519029762072,0.32272428126423597,0.35570166618227517,0.37624682428887424,0.3375598662727393
Look for primary sources or official statements,0.33368730892968335,0.40998812482958763,0.36782834892872796,0.4121203983260539,0.37653876235426315
Pay attention to the reputation or credibility of the author or publication,0.4037820731066149,0.40929732917083766,0.39718112996543636,0.4599044679444512,0.4163546610573398
Read sources I believe are accurate,0.40623814094985666,0.5571352882919337,0.49018635572990893,0.5301435321871308,0.48880135130181174
