,Age: 18-34,Age: 18-34,Age: 18-34,Age: 18-34,Age: 18-34,Age: 35-44,Age: 35-44,Age: 35-44,Age: 35-44,Age: 35-44,Age: 45-64,Age: 45-64,Age: 45-64,Age: 45-64,Age: 45-64,Age: 65+,Age: 65+,Age: 65+,Age: 65+,Age: 65+
,Information about how to register and vote,Information about how elections are run,Information about who won an election,Information about candidates,News about campaigns,Information about how to register and vote,Information about how elections are run,Information about who won an election,Information about candidates,News about campaigns,Information about how to register and vote,Information about how elections are run,Information about who won an election,Information about candidates,News about campaigns,Information about how to register and vote,Information about how elections are run,Information about who won an election,Information about candidates,News about campaigns
Consistently throughout the year,0.16528800192207266,0.13432251277258786,0.1899843782543708,0.2638940492510869,0.21619447004310016,0.1571065738062367,0.1607157569208689,0.15626262638351285,0.24356825739698,0.18508173169050257,0.1407581577272151,0.19425002486835183,0.20394882639056613,0.2764923267677972,0.2556749502388732,0.14945281989669734,0.17174438418066332,0.19523255050384716,0.28896835504548485,0.24214913824077178
Regularly in the weeks around major election dates or deadlines,0.18929848723567735,0.18999960479919792,0.1837885267868369,0.2388669243241329,0.2302129990672706,0.19680169611038073,0.19642494420522305,0.1962628028946759,0.23006188487177298,0.24750949510619294,0.18674384161563296,0.17660343408159776,0.21288178656070708,0.285182347489082,0.25405204925894764,0.17722470397870374,0.18675855381195394,0.21287518880030562,0.2671132125562446,0.2650796250507905
Never,0.19107620391278243,0.22777790078650056,0.12479250918286489,0.14052764492753012,0.15145483124692913,0.2009442197589061,0.20853859969840477,0.07761348001749646,0.09684347467656018,0.1256352250787776,0.299099873418412,0.24746858253967408,0.10543612428866914,0.10617593711643113,0.16117845468686073,0.2706132932553099,0.23490825051606357,0.09336423012835451,0.10115647317652075,0.13541626888803346
A few times in the weeks around major election dates or deadlines,0.2016935451476381,0.23869006569449838,0.19652618107144407,0.1903341746046537,0.21628076772230342,0.1315279966207241,0.18403842325885147,0.22050736121586545,0.21381469519902035,0.22802377897784884,0.11683796445958475,0.16874232555039115,0.12275241198844301,0.17035553425123554,0.16720780262401808,0.14246396434790085,0.1866668633143176,0.15653634970580463,0.18259524791494003,0.19265765217000988
"Only around major election dates or deadlines (e.g. Voter registration deadlines, Election Day)",0.25264376178182946,0.20920991594721536,0.3049084047044832,0.16637720689259644,0.1858569319203965,0.3136195137037524,0.25028227591665186,0.3493537294884491,0.2157116878556663,0.21374976914667806,0.2565601627791552,0.21293563295998524,0.35498085077161445,0.16179385437545402,0.16188674319130028,0.2602452185213881,0.21992194817700159,0.34199168086168813,0.16016671130680976,0.16469731565039447
