,Age: 18-34,Age: 35-44,Age: 45-64,Age: 65+,overall
"Other, please specify",0.011474829204372225,0.018823110774340297,0.03045568448022368,0.031841602671556994,0.02412681014113034
Civic or religious organizations in your community,0.0640608578983484,0.07195891433551817,0.02433142624462839,0.02627217266867605,0.042359447191415066
Don't know/ No opinion,0.06605127888620979,0.07284003494738579,0.06032389303948495,0.03101111570582003,0.056424597395635455
State election administrators,0.09009217472179916,0.10947682253699814,0.1436682589194723,0.1644859326523475,0.129803837716067
A national political party organization,0.091770934197822,0.0676596852101486,0.11235465085077713,0.1093619666927523,0.09944474481346563
"Elected officials at any level (e.g. mayors, governors, Congress members)",0.10625380971738528,0.11207449510955073,0.079383575649164,0.08046239005660466,0.09159186290406586
Local or county administrators,0.10799059681388103,0.06202449660740057,0.11575616983833013,0.1266471840925441,0.10821443600364353
Your preferred candidate,0.10907933913097516,0.09212231565740586,0.10608619829644628,0.10053785693690451,0.10333090644668703
"Fact-checking organizations (e.g. Snopes, PolitiFact, AP Fact Check, etc.)",0.1533972823868385,0.13232579703267894,0.10206446800256298,0.08121845717438415,0.11474058246597815
"Your favorite commentator or analyst from a radio show, podcast, TV show, blog, or newspaper",0.15542216140442855,0.21084658602391762,0.1537912068444239,0.20560391176344242,0.17587197511396394
Election-related organizations (including integrity and voting rights groups),0.18475205400531272,0.13776281584677158,0.11974858109347876,0.1330033359017465,0.14255161691442994
A federal agency or website dedicated to elections (e.g. the U.S. Election Assistance Commission or vote.gov),0.1965832458097344,0.21908936120911546,0.18939304702971402,0.22299807144472783,0.2041705866078446
"Your favorite social media influencer or content creator (e.g. TikTok, X/Twitter, Reels, etc.)",0.20077530950410644,0.190328963263788,0.11502299525726324,0.04273347418794504,0.1306749920041737
Friends and family,0.20601134648037542,0.18450338377537515,0.16850718101900625,0.11348734569735196,0.16692519655658283
"News media professionals (local/national TV news anchors, journalists, reporters)",0.3363753359560851,0.4266738595745027,0.48633210812186645,0.6222016227212724,0.472378787106205
